{"$id":"performanceThresholdApproval.v1","$schema":"https://json-schema.org/draft/2020-12/schema","additionalProperties":false,"properties":{"approvalID":{"maxLength":128,"pattern":"^[A-Za-z0-9][A-Za-z0-9._:-]{0,127}$","type":"string"},"approvedAtUTC":{"maxLength":64,"minLength":1,"type":"string"},"approvedByRole":{"const":"releaseOwner","type":"string"},"baselineEvidenceRunIDs":{"items":{"maxLength":64,"pattern":"^[A-Za-z0-9][A-Za-z0-9._:-]{0,63}$","type":"string"},"maxItems":65536,"minItems":3,"type":"array","uniqueItems":true},"decision":{"const":"approved","type":"string"},"evidenceStoreBindingID":{"maxLength":128,"pattern":"^[A-Za-z0-9][A-Za-z0-9._:-]{0,127}$","type":"string"},"releaseFlowID":{"maxLength":64,"pattern":"^[A-Za-z0-9][A-Za-z0-9._:-]{0,63}$","type":"string"},"schemaVersion":{"const":1,"type":"integer"},"thresholdDecisionHash":{"maxLength":64,"pattern":"^[0-9a-f]{64}$","type":"string"},"thresholdDecisionID":{"maxLength":128,"pattern":"^[A-Za-z0-9][A-Za-z0-9._:-]{0,127}$","type":"string"},"thresholdProfileHash":{"maxLength":64,"pattern":"^[0-9a-f]{64}$","type":"string"},"thresholdProfileID":{"maxLength":128,"pattern":"^[A-Za-z0-9][A-Za-z0-9._:-]{0,127}$","type":"string"}},"required":["approvalID","approvedAtUTC","approvedByRole","baselineEvidenceRunIDs","decision","evidenceStoreBindingID","releaseFlowID","schemaVersion","thresholdDecisionHash","thresholdDecisionID","thresholdProfileHash","thresholdProfileID"],"type":"object","x-pulsephone-maxEncodedBytes":67108864}