{"approvalID":"approval.synthetic.performance.v1","approvedAtUTC":"2026-07-20T12:05:01Z","approvedByRole":"releaseOwner","baselineEvidenceRunIDs":["run-baseline-1","run-baseline-2","run-baseline-3"],"decision":"approved","evidenceStoreBindingID":"store.synthetic.durable.v1","releaseFlowID":"flow-synthetic-performance-v1","schemaVersion":1,"thresholdDecisionHash":"b0be6179246ef95e981d9422118feb322d74dcf2db4a5b809daacf27314d14af","thresholdDecisionID":"decision.synthetic.performance.v1","thresholdProfileHash":"245acfc431b3c315892bee6c77f75177599211d129503bcadd8eead8e161539e","thresholdProfileID":"threshold.synthetic.performance.v1"}